{
  "schema": "minimoi.activity.v2",
  "data_scope": "personal",
  "environment": "prod",
  "domain": "curator",
  "part": "main",
  "local_date": "2026-10-30",
  "tz": "America/Chicago",
  "generation": "8f0c2a91",
  "seq": 4,
  "digest": "sha256:4cf0532b64f63b53d57a5577cdea8e528b25f16f2d0cba16312441ce2a18b337",
  "producer": {
    "host": "prod-ec2-1",
    "service": "minimoi-curator",
    "image_tag": "1.2.0",
    "commit": "4f531c6f"
  },
  "metric": "feedback_actions",
  "observation": {
    "state": "complete",
    "covers": {
      "from": "2026-10-30T00:00:00-05:00",
      "to": "2026-10-30T23:59:59-05:00"
    },
    "source_checked_at": "2026-10-31T00:20:00-05:00",
    "final": true
  },
  "published_at": "2026-10-31T00:20:01-05:00",
  "count": 0,
  "items": [],
  "items_total": 0,
  "items_truncated": false,
  "withdrawn": [],
  "health": {
    "writer_last_ok": "2026-10-31T00:20:01-05:00",
    "last_error": null
  }
}
