{
  "schema": "minimoi.activity.v2",
  "data_scope": "personal",
  "environment": "prod",
  "domain": "german",
  "part": "main",
  "local_date": "2026-10-30",
  "tz": "America/Chicago",
  "generation": "8f0c2a91",
  "seq": 4,
  "digest": "sha256:9ee473ef3ebe8599d0253650bbcb4f512aac0d43fded7d8bf0658ae2744b939c",
  "producer": {
    "host": "prod-ec2-1",
    "service": "minimoi-german",
    "image_tag": "1.2.0",
    "commit": "4f531c6f"
  },
  "metric": "sessions_completed",
  "observation": {
    "state": "complete",
    "covers": {
      "from": "2026-10-30T00:00:00-05:00",
      "to": "2026-10-30T23:59:59-05:00"
    },
    "source_checked_at": "2026-10-31T00:20:00-05:00",
    "final": true
  },
  "published_at": "2026-10-31T00:20:01-05:00",
  "count": 2,
  "items": [
    {
      "event_id": "german-sess-2026-10-30_001",
      "kind": "session",
      "time_precision": "day",
      "event_date": "2026-10-30",
      "one_line": "Gespräche · Dativ",
      "ref": {
        "type": "german.session",
        "id": "2026-10-30_001",
        "revision": 1
      },
      "link": "/german/sessions/2026-10-30_001"
    },
    {
      "event_id": "german-ws-20261030_141000",
      "kind": "writing",
      "time_precision": "second",
      "event_time": "2026-10-30T14:10:00-05:00",
      "one_line": "Tagebuch · 120 Wörter",
      "ref": {
        "type": "german.writing",
        "id": "ws_20261030_141000"
      }
    }
  ],
  "items_total": 2,
  "items_truncated": false,
  "withdrawn": [],
  "health": {
    "writer_last_ok": "2026-10-31T00:20:01-05:00",
    "last_error": null
  }
}
